{
  "schema_version": "3.0.0",
  "project": {
    "title": "",
    "researcher": "",
    "institution": "",
    "domain": ""
  },
  "questions": [
    {
      "id": 1,
      "priority": "primary",
      "text": "",
      "type": "descriptive",
      "hypothesis": "",
      "outcome": [],
      "predictor": [],
      "covariates": [],
      "files": [],
      "prep": "",
      "prior": ""
    }
  ],
  "data": {
    "files": [
      {
        "name": "",
        "description": "",
        "format": "csv",
        "path": "data/raw/",
        "estimated_rows": null,
        "estimated_columns": null,
        "identifiers": [],
        "time_period": "",
        "issues": []
      }
    ],
    "relationships": []
  },
  "context": {
    "target_output": "journal_article",
    "target_venue": "",
    "timeline": "",
    "ethics": "not_required",
    "constraints": "",
    "prior_work": "",
    "notes": ""
  },
  "metadata": {
    "created": "",
    "last_updated": "",
    "version": 1,
    "method": "manual"
  }
}
